{
  "schema": "semantic-analysis-training-record/v1",
  "record_id": "celebrity-live-action-opening-v11-20260905",
  "created_at": "2026-09-05T00:00:00+08:00",
  "authorization": {
    "scope": "Create V11 from the corrected celebrity live-action opening study and repair V10 semantic gates that are missing or too strict.",
    "current_user_explicit": true,
    "reference": "Current user: 根据你的结论帮我出优化后的V11"
  },
  "source_batch": {
    "batch_name": "V10 plus celebrity live-action opening reference evidence",
    "sources": [
      {
        "source_path": "C:\\Users\\dd\\Documents\\Codex\\2026-09-03\\new-chat-3\\outputs\\新素材语义分析能力包_训练备份_v10.zip",
        "source_sha256": "9121c947ea317870b3bf626ed72b04629b2ecbd25868992e91e7789301cb6a19",
        "processing_stage": "validated V10 lineage"
      },
      {
        "source_path": "C:\\Users\\dd\\Downloads\\无尽冬日-260227007-明星混剪\\无尽冬日-260227007-明星混剪\\无尽冬日-260227007-明星混剪\\李乃文\\APP\\GOFCN49591_明星_李乃文_混剪_多场景_真得砍树1_APP.mp4",
        "source_sha256": "f8364c63018c0d0baed378b263fcca07b57e0510dc24197f398f9dd499feb967",
        "processing_stage": "finished-ad live-action opening reference"
      },
      {
        "source_path": "C:\\Users\\dd\\Downloads\\无尽冬日-260227007-明星混剪\\无尽冬日-260227007-明星混剪\\无尽冬日-260227007-明星混剪\\小沈阳\\APP\\GOFCN49617_明星_小沈阳_混剪_多场景_立马砍树_APP.mp4",
        "source_sha256": "b3f7ce026fb8c1be0d8a5846d949ea04a1cba69053f62b4fdd50228b8b1ab38e",
        "processing_stage": "finished-ad live-action opening reference"
      },
      {
        "source_path": "C:\\Users\\dd\\Downloads\\无尽冬日-260227007-明星混剪\\无尽冬日-260227007-明星混剪\\无尽冬日-260227007-明星混剪\\双明星\\APP\\GOFCN49635_明星_双明星_混剪_多场景_同台比拼1_APP.mp4",
        "source_sha256": "de138d6acef47d765d49e19167b61d7d56fc1ca5954538d58439655906824796",
        "processing_stage": "finished-ad live-action opening reference"
      }
    ]
  },
  "analysis_snapshot": {
    "snapshot_id": "celebrity-live-action-opening-gate-correction-v11",
    "scope": "Learn only the celebrity live-action opening and convert demonstrated V10 gaps into profile-scoped executable checks.",
    "evidence_limits": [
      "Gameplay, gameplay narration, end cards and CTA are outside the learned content scope.",
      "Finished-ad evidence establishes edit structure; it does not automatically approve any raw source interval.",
      "The new allowances apply only when the V11 live-action-opening profile is explicitly selected."
    ],
    "approved": [
      {
        "scope": "same celebrity across adjacent live-action scenes",
        "conditions": ["hash-bound visual change evidence", "permitted semantic relation", "non-empty information gain", "different proposition IDs"]
      },
      {
        "scope": "complete 0.8--3.0 second reaction",
        "conditions": ["complete opening and closing", "direct hook or response role", "not a replacement for the performance anchor"]
      }
    ],
    "conditional": [
      {
        "scope": "A-B-A celebrity return",
        "recheck": "Require answer, counterpoint, continued round, escalation or payoff as a structured return reason."
      }
    ],
    "rejected": [
      {
        "scope": "full-screen gameplay, gameplay voice-over after the boundary, end card or CTA",
        "risk_codes": ["NON_LIVE_ACTION_CONTENT", "FULLSCREEN_GAME_BOUNDARY_CROSSED", "CTA_OR_HARD_TEXT_CONFLICT"]
      },
      {
        "scope": "unconditional same-person rejection and universal 35 percent speaker share",
        "risk_codes": ["OVERSTRICT_SINGLE_STAR_GATE"],
        "observed": "The learned single-star and two-star openings legitimately reuse the same celebrity while changing performance visuals and information."
      },
      {
        "scope": "V10 witness-sufficient prose with exhaustive runtime behavior",
        "risk_codes": ["WITNESS_MODE_NOT_EXECUTED"],
        "observed": "The runtime forced every listed source to exhausted and the input schema omitted witness_sufficient."
      }
    ]
  },
  "feedback": [
    {
      "date": "2026-09-05",
      "kind": "celebrity live-action opening scope correction",
      "human_correction": "Learn only the celebrity live-action opening. Do not learn full-screen gameplay, the game tail, end card or CTA.",
      "required_gate_change": "Add an explicit live-action content profile, first-fullscreen-game boundary evidence, structured CTA and identity evidence, conditional same-person adjacency, short complete reactions and executable semantic relations."
    }
  ],
  "record_content_sha256": "1b88eb8aa6a95f14b411281f36a31ea3dce40deb71595f3691c95f9c0ad9ab77"
}
