{
  "schema": "semantic-analysis-training-record/v1",
  "record_id": "heartbeat-chunk-recovery-v9-20260905",
  "created_at": "2026-09-05T13:12:17+08:00",
  "authorization": {"scope": "Create V9 correcting V8 detached-worker failure with bounded heartbeat slices, CUDA preflight, progress-aware recovery and mandatory checkpoints.", "current_user_explicit": true, "reference": "Current user, 2026-09-05: 修复导出V9"},
  "source_batch": {
    "batch_name": "V8 detached-worker failure evidence",
    "sources": [
      {"source_path": "C:\\Users\\dd\\Documents\\Codex\\2026-09-03\\new-chat-3\\outputs\\新素材语义分析能力包_训练备份_v8.zip", "source_sha256": "c0466cb571691f5228b949c9c93412b6c87158077f86db02c6df6e47d8977a74", "processing_stage": "validated V8 lineage"},
      {"source_path": "C:\\Users\\dd\\Documents\\Codex\\2026-09-03\\video-fast-output-optimization\\work\\combined-v8-50-20260905\\orchestrator_state.json", "source_sha256": "e515eb0c7cfc897e65e721383eb21e78ed97bf4d46628c3f5c5d47662f28d4fb", "processing_stage": "V8 failed orchestrator state"},
      {"source_path": "C:\\Users\\dd\\Documents\\Codex\\2026-09-03\\video-fast-output-optimization\\work\\combined-v8-50-20260905\\source_asr_progress.json", "source_sha256": "611a3304e4b0032086d12b3502779a043817346e6d8735552fad1e53f288dd6f", "processing_stage": "V8 durable six-source progress"},
      {"source_path": "C:\\Users\\dd\\Documents\\Codex\\2026-09-03\\video-fast-output-optimization\\work\\combined-v8-50-20260905\\.v8\\logs\\00-SOURCE_ASR-attempt0.stdout.log", "source_sha256": "a025a82660a904029e1f01c85d0e2b4541f99ddffa514ebcbb4578571a17effa", "processing_stage": "V8 missing-cublas failure evidence"},
      {"source_path": "C:\\Users\\dd\\Documents\\Codex\\2026-09-03\\video-fast-output-optimization\\work\\combined-v8-50-20260905\\.v8\\logs\\00-SOURCE_ASR-attempt1.stderr.log", "source_sha256": "982d8ec6bc2d6e6edef9a7b078641b7ddb8299f945f3323b54d142a67b1086fd", "processing_stage": "V8 abrupt CPU worker termination evidence"},
      {"source_path": "C:\\Users\\dd\\Documents\\Codex\\2026-09-03\\video-fast-output-optimization\\work\\combined-v8-50-20260905\\.v8\\phase_results\\00-SOURCE_ASR-attempt1.json.tmp", "source_sha256": "e3b0c44298fc1c149afbf4c8996fb92427ae41e4649b934ca495991b7852b855", "processing_stage": "V8 zero-byte incomplete result marker"},
      {"source_path": "C:\\Users\\dd\\AppData\\Local\\Temp\\codex-clipboard-e9b4ccad-1d22-4b16-9ff2-fe58a1ab2bb8.png", "source_sha256": "7fb0cb6b1ecdec4c732fa6787a1eba660987da51dc290abe6f20a6de3f072d1c", "processing_stage": "user-supplied V8 failure evidence"}
    ]
  },
  "analysis_snapshot": {
    "snapshot_id": "v8-detached-worker-to-v9-heartbeat-slices-v1",
    "scope": "Correct V8 orchestration and recovery; no source-media candidate is reclassified.",
    "evidence_limits": ["The abrupt termination cause is inferred from process/result evidence; no Windows crash dump exists.", "The record does not restart or alter the failed V8 task.", "Model phases still require the registered Codex heartbeat."],
    "approved": [], "conditional": [],
    "rejected": [
      {"scope": "long-lived detached production worker across Codex turns", "risk_codes": ["WORKER_RESULT_MARKER_MISSING", "MANAGED_PROCESS_LIFETIME"], "observed": "CPU ASR made six durable outputs, then disappeared before final result-marker promotion."},
      {"scope": "device fallback consuming business retry", "risk_codes": ["CUDA_DEPENDENCY_MISSING", "RETRY_BUDGET_MISCLASSIFIED"], "observed": "Missing cublas consumed the first task retry before CPU processing began."}
    ]
  },
  "feedback": [{"date": "2026-09-05", "kind": "heartbeat-slice recovery correction", "human_correction": "Export a V9 that does not stop because a long background worker is reclaimed.", "required_gate_change": "Run bounded synchronous chunks, preflight CUDA, resume atomic progress, separate device fallback from business retries, and require Winky checkpoints."}],
  "record_content_sha256": "fc3830ce13febd80494182ebaf75aca9f23df9d2f398769259c64bcbbf77de71"
}
