{
  "schema": "semantic-analysis-training-record/v1",
  "record_id": "performance-led-mixed-edit-and-output-boundary-v6-20260904",
  "created_at": "2026-09-04T17:55:00+08:00",
  "authorization": {
    "scope": "Create V6 of the semantic-analysis training backup with performance-led mixed-edit and output-boundary corrections.",
    "current_user_explicit": true,
    "reference": "Current user, 2026-09-04: 你帮我做V6"
  },
  "source_batch": {
    "batch_name": "performance-led mixed-edit regression and rendered-output failure evidence",
    "sources": [
      {
        "source_path": "C:\\Users\\dd\\Documents\\Codex\\2026-08-18\\new-chat\\outputs\\明星口播混剪100条_25到30秒_低重复严检_20260825\\plan_audit.json",
        "source_sha256": "1d32eec2cd4fda0bab4a6002b867004b8d4857344a0b97dc88c4a73fc16c6ada",
        "processing_stage": "historical approved performance-led plan audit"
      },
      {
        "source_path": "C:\\Users\\dd\\Documents\\Codex\\2026-08-18\\new-chat\\outputs\\明星口播混剪100条_25到30秒_低重复严检_20260825\\plans_review.txt",
        "source_sha256": "190a8cf2b50dfbf6d5d7e3855626a7066969d6fdad3a4a7958d3d552095aa455",
        "processing_stage": "historical approved performance-led route evidence"
      },
      {
        "source_path": "C:\\Users\\dd\\Documents\\Codex\\2026-09-03\\video-fast-output-optimization\\work\\combined-v4-50-20260904\\sol_qc_repair34r2\\manifest_group1.json",
        "source_sha256": "5018fe1c1d0fc16bcc43e8a84811615c331f9337226b69087df8e45eb8162625",
        "processing_stage": "rendered-output Sol rejection evidence group 1"
      },
      {
        "source_path": "C:\\Users\\dd\\Documents\\Codex\\2026-09-03\\video-fast-output-optimization\\work\\combined-v4-50-20260904\\sol_qc_repair34r2\\manifest_group2.json",
        "source_sha256": "a99d67c58cc4a890833946cf62333d0812c0afe9958f1d441d20806abf2db004",
        "processing_stage": "rendered-output Sol rejection evidence group 2"
      },
      {
        "source_path": "C:\\Users\\dd\\Documents\\Codex\\2026-09-03\\video-fast-output-optimization\\work\\combined-v4-50-20260904\\sol_qc_repair34r2\\manifest_group3.json",
        "source_sha256": "649e804d0e469a682e0a086a7c6622f6e22e211c58cff810462ce2ec05a4f216",
        "processing_stage": "rendered-output Sol rejection evidence group 3"
      }
    ]
  },
  "analysis_snapshot": {
    "snapshot_id": "performance-led-style-and-output-boundary-correction-v1",
    "scope": "Correct planning style and candidate/output boundary gates; no original source-media interval is reclassified by this record.",
    "evidence_limits": [
      "Historical plans establish a desired structural rhythm but do not automatically approve their source intervals under V6.",
      "Rendered-output rejections establish planning and boundary failure patterns but do not authorize automatic repairs or source reclassification.",
      "This record does not authorize a production plan, rendering, or publication."
    ],
    "approved": [],
    "conditional": [],
    "rejected": [
      {
        "scope": "fixed four-fragment 17--23 second planning profile",
        "risk_codes": ["FRAGMENT_CHAIN", "MISSING_PERFORMANCE_ANCHOR"],
        "observed": "The repair batch used 34 four-shot plans with mean source segment duration 5.06 seconds, no segment over 8 seconds, and 22 segments under 3 seconds; it did not preserve the established performance-led montage rhythm."
      },
      {
        "scope": "candidate approval based on intended transcript without output-boundary proof",
        "risk_codes": ["ACTUAL_ASR_MISMATCH", "DEPENDENT_OPENING", "OPEN_TAIL", "BOUNDARY_CROSSING_SPEECH"],
        "observed": "Sol rejected all 34 rendered repairs for one or more incomplete/dependent utterance, residual/crossing voice, visual-boundary freeze or semantic-route failure."
      },
      {
        "scope": "entity-overlap semantic relation",
        "risk_codes": ["KEYWORD_ONLY_BRIDGE", "REPEATED_MECHANISM_WITHOUT_PROGRESS", "PROPOSITION_RESET"],
        "observed": "Declared chains using shared entities such as temperature or resources did not necessarily provide a spoken answer, cause, consequence, or payoff."
      }
    ]
  },
  "feedback": [
    {
      "date": "2026-09-04",
      "kind": "performance-led mixed-edit style restoration",
      "human_correction": "For natural celebrity spoken mixed edits, preserve a 7--14 second complete on-camera performance anchor and plan 25--30 seconds with 3--4 segments by editorial role, rather than enforcing a fixed four-fragment explanatory chain.",
      "required_gate_change": "Require the performance_led_mixed_edit/v1 profile, at least one performance anchor, an ordered editorial-role route, and reject fragment chains and keyword-only bridges before plan lock."
    },
    {
      "date": "2026-09-04",
      "kind": "actual speech and cut-boundary correction",
      "human_correction": "A candidate cannot be approved from an intended transcript when actual isolated ASR or cut evidence exposes a dependent opening, open tail, residual voice, or crossing speech.",
      "required_gate_change": "Bind isolated actual ASR and first/last voiced boundaries to every candidate; recheck them at every rendered cut and reject before release."
    }
  ],
  "record_content_sha256": "cd4b53b3d414e56817d365e8173d8ecb111fe0207cb4cb022e2fce21822b82e8"
}
