{
  "schema": "semantic-analysis-training-record/v1",
  "record_id": "autonomous-orchestration-v8-20260905",
  "created_at": "2026-09-05T12:16:15+08:00",
  "authorization": {
    "scope": "Create V8 with automatic complete orchestration, heartbeat continuation, resumable local workers, bounded repair loops, and authorized delivery.",
    "current_user_explicit": true,
    "reference": "Current user, 2026-09-05: 改出来能自动完整编排的V8"
  },
  "source_batch": {
    "batch_name": "V7 orchestration gap evidence",
    "sources": [
      {"source_path": "C:\\Users\\dd\\Documents\\Codex\\2026-09-03\\new-chat-3\\outputs\\新素材语义分析能力包_训练备份_v7.zip", "source_sha256": "9b9fa006397c28b077f35f350b7e0cbe5463eb28f336197dea3a763e390762e6", "processing_stage": "validated V7 package lineage"},
      {"source_path": "C:\\Users\\dd\\Documents\\Codex\\2026-09-03\\video-fast-output-optimization\\work\\combined-v7-50-20260905\\task_state.json", "source_sha256": "f2fe74de620b29fc3d58d9b749110efcab10bdf5c212b1d4d6dad0c7407dbb3c", "processing_stage": "V7 task state at orchestration diagnosis"},
      {"source_path": "C:\\Users\\dd\\Documents\\Codex\\2026-09-03\\video-fast-output-optimization\\work\\combined-v7-50-20260905\\source_asr_v7_184.stdout.log", "source_sha256": "16a9dcfa0021f27f8b14734a5d445f9861a25fc849b4d3c06080036d1a1f0a4b", "processing_stage": "V7 initial GPU OOM evidence"},
      {"source_path": "C:\\Users\\dd\\Documents\\Codex\\2026-09-03\\video-fast-output-optimization\\work\\combined-v7-50-20260905\\source_asr_v7_184_r3.stdout.log", "source_sha256": "f3b2d27f97073352a81112e430b4edc28f35a220e21efc12e25d57f97e75d9c7", "processing_stage": "V7 repeated-model-load MemoryError evidence"},
      {"source_path": "C:\\Users\\dd\\Documents\\Codex\\2026-09-03\\video-fast-output-optimization\\work\\combined-v7-50-20260905\\extract_source_asr_v7.py", "source_sha256": "365ace6f48e5a880b3c5506a92616e1f902707f8866ee3b7c29da052af3fc378", "processing_stage": "V7 task-local ASR implementation"},
      {"source_path": "C:\\Users\\dd\\AppData\\Local\\Temp\\codex-clipboard-ff1e1d10-4b02-405c-ad17-8be074ca721c.png", "source_sha256": "c9fc26921a17d1c3c991aee23a9cc97dfeaa6c98605b2568af5fc4897db9e896", "processing_stage": "user-supplied V7 idle-task evidence"}
    ]
  },
  "analysis_snapshot": {
    "snapshot_id": "v7-gate-runtime-to-v8-autonomous-orchestrator-v1",
    "scope": "Convert demonstrated V7 background-worker and phase-continuation gaps into V8 orchestration; no original source interval is reclassified.",
    "evidence_limits": [
      "This record diagnoses execution and recovery behavior, not the semantic quality of every V7 source.",
      "It does not modify or take over the currently running V7 production task.",
      "Codex Terra/Sol phases still require a registered thread heartbeat because standalone Python cannot invoke Codex model reasoning."
    ],
    "approved": [],
    "conditional": [],
    "rejected": [
      {"scope": "background worker launch treated as task completion", "risk_codes": ["MISSING_HEARTBEAT_REGISTRATION", "NO_AUTOMATIC_PHASE_CONTINUATION"], "observed": "The Codex task became idle while source ASR remained active; no mechanism would advance after ASR completion."},
      {"scope": "one Whisper model load per source and ad-hoc manual restart", "risk_codes": ["GPU_OOM", "MODEL_RELOAD_MEMORY_ERROR", "UNTRACKED_RESTART"], "observed": "GPU and memory failures required multiple task-local script revisions before a stable single-load CPU path ran."}
    ]
  },
  "feedback": [
    {"date": "2026-09-05", "kind": "autonomous production orchestration correction", "human_correction": "The capability must automatically continue the whole job rather than stopping after launching a background phase.", "required_gate_change": "Require heartbeat registration; supervise local phases with durable result markers and progress; hand model phases to the heartbeat; automatically resume, repair within bounded rounds, authorize release, and create the final delivery manifest."}
  ],
  "record_content_sha256": "0a052027ef5f4a67976d65819af1d11cbc1a5aacc3510d901db806e0558dd165"
}
