{
  "schema": "semantic-analysis-training-record/v1",
  "record_id": "wuzimu-ad-close-and-sol-provenance-20260911-v16",
  "created_at": "2026-09-11T15:24:37+08:00",
  "authorization": {
    "scope": "Write the approved Wu Yue copy corrections and failed V15 final-review lessons into the next active semantic judgment package before editing.",
    "current_user_explicit": true,
    "reference": "用户明确要求：剪辑之前归纳一下这次问题写入语义判断里面，下次不要再犯了。"
  },
  "source_batch": {
    "batch_name": "wuzimu-beauty-40-approved-copy-v4-and-v15-failure",
    "sources": [
      {
        "source_path": "C:\\Users\\dd\\Documents\\Codex\\2026-09-10\\montage-three-part-orchestrator-c-users\\outputs\\吴樾40条混剪台词审批稿_V4结尾修正版.md",
        "source_sha256": "b57e95722a8efe78b65e8bfdbcdf5b0272a088bc19b56e04b03b3357a8bc86b4",
        "processing_stage": "user_reviewed_copy_before_final_corrections"
      },
      {
        "source_path": "C:\\Users\\dd\\Documents\\Codex\\2026-09-10\\montage-three-part-orchestrator-c-users\\work\\wuzimu-beauty-v15-copy-draft-v1.json",
        "source_sha256": "1eb112cd7021da027600a49182f2b860f7f869815f705f5c8aa3aed3d11a12bb",
        "processing_stage": "approved_copy_state_with_subsequent_closing_corrections"
      },
      {
        "source_path": "C:\\Users\\dd\\Documents\\Codex\\2026-09-10\\montage-three-part-orchestrator-c-users\\work\\wuzimu-beauty-v15-40\\round_0\\output_qc_report.json",
        "source_sha256": "56904ff076706000cbc7575b379bb661a3fc8f065f1a678ae216efc5e133944b",
        "processing_stage": "rejected_template_like_v15_final_qc"
      },
      {
        "source_path": "C:\\Users\\dd\\Documents\\Codex\\2026-09-03\\video-fast-output-optimization\\outputs\\吴樾混剪修复版28条_先交_不含26_29_20260908\\交付清单.json",
        "source_sha256": "d11fe14a09e3740e484e84ee840907eae27ffcacc7931ed62072e66f52a03d8e",
        "processing_stage": "positive_comparative_release_evidence"
      }
    ]
  },
  "analysis_snapshot": {
    "snapshot_id": "wuzimu-v16-ad-close-and-review-provenance-20260911",
    "scope": "User corrections made while approving the complete 40-item Wu Yue copy batch and audit of the V15 Sol release evidence.",
    "evidence_limits": [
      "The user approved the V4 direction and then supplied additional closing corrections; the latest explicit correction overrides earlier draft endings.",
      "The phrases 轻轻松松 and 中年人的解压神器 are source-family closes only when earned by the preceding chain, not universal closes for unrelated products.",
      "A declared model role is not cryptographic model provenance; V18 records execution identity and review time but still requires local validation."
    ],
    "approved": [
      "Use one forward advertising spine: product/premise, mechanism, result, close.",
      "Use numeric survivor counts as intermediate evidence or dialogue, never as the final advertising close.",
      "Use 轻轻松松 after a completed result; use 中年人的解压神器 as a release close when the preceding edit supports an ease/relief claim.",
      "When a later-state result such as combat power opens the edit, insert an explicit how/why bridge before returning to mechanics.",
      "Preserve the real distinction between the person name 吴樾 and the spoken address 樾哥."
    ],
    "conditional": [
      "零下七十度 and 盗版 remain allowed for this user-authorized source family.",
      "A short closing reaction under two seconds is allowed only when the user selected it and the preceding chain fully earns it."
    ],
    "rejected": [
      "The sentence 我也不装了，我摊牌了，我熔炉满级了 in this source family.",
      "Numeric endings such as 我收了十个幸存者 or 我收了三十个幸存者.",
      "Final segments that stop at a method step such as chopping trees, lighting/upgrading the furnace, raising temperature or generic development.",
      "Unanswered questions, complaint-to-mechanic jumps, result-before-mechanism regression without an explanation bridge, and unrelated slogan endings.",
      "Stacking equivalent ease claims such as 易如反掌, 小意思, so easy and 轻轻松松 in one edit.",
      "Template-identical Sol passes or claims of full normal-speed listening whose elapsed time is shorter than the rendered audio."
    ]
  },
  "feedback": [
    {"rule": "AD_CLOSE_REQUIRED", "examples": ["数字型幸存者数量只能放在中段", "纯玩法步骤不能作结尾"]},
    {"rule": "WUZIMU_HARD_EXCLUDED_PHRASE", "phrase": "我也不装了，我摊牌了，我熔炉满级了"},
    {"rule": "EARNED_EASE_CLOSE", "approved": ["这还不是轻轻松松", "玩无尽冬日，这才是中年人的解压神器"], "condition": "must follow a complete result and must not stack an equivalent ease claim"},
    {"rule": "SOL_REVIEW_TIME_PROOF", "evidence": "The failed batch contained 743.86 seconds of audio, while the final-QC artifact was created about 78 seconds after the model phase opened."}
  ],
  "record_content_sha256": "eda986ac69558c7ff4f2a4958d37c702be90c060143353267bde7628770eb568"
}
