{
  "schema": "semantic-analysis-training-record/v1",
  "record_id": "candidate-inventory-correction-v4-20260904",
  "created_at": "2026-09-04T00:00:00+08:00",
  "authorization": {
    "scope": "Create V4 of the semantic-analysis training backup and append a correction to V3 candidate-inventory semantics.",
    "current_user_explicit": true,
    "reference": "Current user, 2026-09-04: 帮我更新一下V4"
  },
  "source_batch": {
    "batch_name": "V3 candidate-inventory correction feedback",
    "sources": [
      {
        "source_path": "C:\\Users\\dd\\Documents\\Codex\\2026-09-03\\new-chat-3\\outputs\\新素材语义分析能力包_训练备份_v3.zip",
        "source_sha256": "55aced769d733105b82639168c7484367429fca0459b7198732a997cebf45121",
        "processing_stage": "V3 package lineage evidence"
      },
      {
        "source_path": "C:\\Users\\dd\\AppData\\Local\\Temp\\codex-clipboard-1e8f3aeb-b7c0-444a-bcf4-1981cd8de9e3.png",
        "source_sha256": "45aef68c124ed843bf9227b16548bc80ae439c96a93f4a6708ddbe16e6d6a86d",
        "processing_stage": "user-supplied V3 correction evidence"
      },
      {
        "source_path": "C:\\Users\\dd\\AppData\\Local\\Temp\\codex-clipboard-02996b13-e021-4d41-92c8-0a3b2a184ec1.png",
        "source_sha256": "253475844d53a3a5af4cff301c9acd927d32a607e546d0b7c35e0eb53ff1bec8",
        "processing_stage": "user-supplied V3 capacity-claim evidence"
      }
    ]
  },
  "analysis_snapshot": {
    "snapshot_id": "v3-candidate-inventory-semantics-correction-v1",
    "scope": "Correct source, registry-item, candidate, and capacity-preflight semantics. No original source-media interval is reclassified.",
    "evidence_limits": [
      "This is a user-feedback correction record, not an independent recount of all underlying source media.",
      "It does not establish a final candidate count for any batch.",
      "It does not authorize adding source media, modifying a production plan, rendering, or publishing."
    ],
    "approved": [],
    "conditional": [],
    "rejected": [
      {
        "scope": "V3 interpretation of candidate capacity",
        "risk_codes": ["CANDIDATE_INVENTORY_INCOMPLETE"],
        "observed": "Treating a safe-interval registry or source-file count as an exhausted inventory of complete candidates."
      }
    ]
  },
  "feedback": [
    {
      "date": "2026-09-04",
      "kind": "candidate-inventory semantics correction",
      "human_correction": "A source file may yield many complete candidates. Source reuse is unlimited; the two-use gate applies only to the same exact canonical candidate. Capacity may be called insufficient only after declared sources are exhausted.",
      "required_gate_change": "Report CANDIDATE_INVENTORY_INCOMPLETE for partial extraction, continue extraction from the existing declared sources, and only then evaluate candidate, speaker, and semantic capacities."
    }
  ],
  "record_content_sha256": "0bb2fa2e1d6c93132f2d8957b7d9e24c831a2e67e8f3162c0678fd2be9fa5092"
}
