{
  "schema": "semantic-analysis-training-record/v1",
  "record_id": "continuous-rolling-balanced-gates-v10-20260905",
  "created_at": "2026-09-05T00:00:00+08:00",
  "authorization": {
    "scope": "Create V10 with continuous execution, five-item rolling render/QC/repair and evidence-calibrated diversity gates.",
    "current_user_explicit": true,
    "reference": "Current user: 首先一直持续执行直到出片；检查门禁是否太严格；出V10"
  },
  "source_batch": {
    "batch_name": "accepted historical 50/100 workflow evidence",
    "sources": [
      {
        "source_path": "C:\\Users\\dd\\Documents\\Codex\\2026-09-03\\new-chat-3\\outputs\\新素材语义分析能力包_训练备份_v9.zip",
        "source_sha256": "5fe63ea2fe349c35ca0703cb1149b89b4c76a98cbe615df3b05add43d40e67e0",
        "processing_stage": "validated V9 lineage"
      },
      {
        "source_path": "C:\\Users\\dd\\Documents\\Codex\\2026-08-18\\new-chat\\outputs\\明星口播混剪50条_25到30秒_低重复严检_20260825\\低重复率审计.json",
        "source_sha256": "6562fe59b3c8f9a07e12795f0f0b751a59c367af56485c919e9758cd2348f5e9",
        "processing_stage": "accepted 50-output low-repeat audit"
      },
      {
        "source_path": "C:\\Users\\dd\\Documents\\Codex\\2026-08-18\\new-chat\\outputs\\明星口播混剪100条_25到30秒_低重复严检_20260825\\plan_audit.json",
        "source_sha256": "1d32eec2cd4fda0bab4a6002b867004b8d4857344a0b97dc88c4a73fc16c6ada",
        "processing_stage": "accepted 100-output plan audit"
      },
      {
        "source_path": "C:\\Users\\dd\\Documents\\Codex\\2026-08-18\\new-chat\\outputs\\明星口播混剪100条_25到30秒_低重复严检_20260825\\qc.json",
        "source_sha256": "eb80a60800c22f3146030ee10e32c9bd788cc604618d89b797f1afe014cc2597",
        "processing_stage": "accepted 100-output QC"
      }
    ]
  },
  "analysis_snapshot": {
    "snapshot_id": "continuous-rolling-balanced-gates-v10",
    "scope": "Calibrate execution cadence and diversity gates from accepted batches without reclassifying source candidates.",
    "evidence_limits": [
      "Historical acceptance does not waive current identity, CTA, speech or boundary evidence.",
      "V10 does not modify active V9 tasks."
    ],
    "approved": [],
    "conditional": [],
    "rejected": [
      {
        "scope": "five-minute heartbeat as normal execution clock",
        "risk_codes": [
          "ARTIFICIAL_IDLE_GAP"
        ],
        "observed": "One-minute chunks waited roughly four minutes between scheduled wakes."
      },
      {
        "scope": "universal candidate<=2, semantic-cluster<=3, route-use=1 and exhaustive inventory",
        "risk_codes": [
          "ARTIFICIAL_CAPACITY_SHORTAGE"
        ],
        "observed": "Stricter than both accepted 50 and 100 output audits without targeting their actual quality controls."
      }
    ]
  },
  "feedback": [
    {
      "date": "2026-09-05",
      "kind": "continuous rolling and balanced gate correction",
      "human_correction": "Run continuously until videos exist; render and repair in rolling groups of five; calibrate reuse using accepted low-repeat evidence.",
      "required_gate_change": "Use foreground run-continuous, recovery-only heartbeat, witness-sufficient inventory with reserve, pairwise low-repeat and unchanged hard identity/speech/boundary/Sol gates."
    }
  ],
  "record_content_sha256": "07286ab1e0f870d9e95eeb6b6a49f88da1e36626ee143a503e4bc832e4ad17fa"
}
