{
  "schema": "semantic-analysis-training-record/v1",
  "record_id": "batch-diversity-gates-v3-20260903",
  "created_at": "2026-09-03T20:54:51+08:00",
  "authorization": {
    "scope": "Create V3 of the semantic-analysis training backup with batch-level diversity gates and a scoped feedback record.",
    "current_user_explicit": true,
    "reference": "Current user, 2026-09-03: 你帮我出V3版本吧"
  },
  "source_batch": {
    "batch_name": "portable-e2e-20-20260903 planning-evidence feedback",
    "sources": [
      {
        "source_path": "C:\\Users\\dd\\Documents\\Codex\\2026-09-03\\video-fast-output-optimization\\outputs\\portable-e2e-20-20260903\\候选人物身份审计.json",
        "source_sha256": "ce8bb7d204e6e6ad7026f50df5b081b48e643074d94bce9e5fd3063b7bb650b6",
        "processing_stage": "r3 candidate identity audit evidence"
      },
      {
        "source_path": "C:\\Users\\dd\\Documents\\Codex\\2026-09-03\\video-fast-output-optimization\\outputs\\portable-e2e-20-20260903\\Terra批量计划报告.json",
        "source_sha256": "a7bad0145890b1f499501e2ee94db81472935475dd45d78f95a956a6765223b1",
        "processing_stage": "r3 locked-plan batch report evidence"
      },
      {
        "source_path": "C:\\Users\\dd\\Documents\\Codex\\2026-09-03\\video-fast-output-optimization\\outputs\\portable-e2e-20-20260903\\20条实测报告.json",
        "source_sha256": "dd99cf1824db9bba5aaa4df67579bd33624f54d240be37d4906bd40301842d63",
        "processing_stage": "final delivered-batch measured evidence"
      }
    ]
  },
  "analysis_snapshot": {
    "snapshot_id": "portable-e2e-20-batch-diversity-retro-audit-v1",
    "scope": "Observed batch-level candidate allocation and gate coverage in delivered planning evidence; no source interval is reclassified.",
    "evidence_limits": [
      "The record verifies the supplied JSON evidence hashes, not the byte hashes of original media sources.",
      "It records a planning failure pattern and does not make new source-level approvals or rejections.",
      "A connector hard-exclusion policy was not inferred from prior-conversation screenshots; V3 makes it an explicit per-batch field."
    ],
    "approved": [],
    "conditional": [],
    "rejected": [
      {
        "scope": "existing batch-plan approach",
        "risk_codes": [
          "CANDIDATE_POOL_SHORTAGE",
          "SPEAKER_SHARE_EXCEEDED",
          "CANDIDATE_REUSE_EXCEEDED",
          "MISSING_REQUIRED_TRACEABILITY"
        ],
        "observed": "18 eligible candidates were used to fill 80 planned segments; two of four eligible speakers received zero planned shots."
      }
    ]
  },
  "feedback": [
    {
      "date": "2026-09-03",
      "kind": "batch-diversity planning correction",
      "human_correction": "Add a single-person share ceiling, a two-use candidate ceiling, and a three-use semantic-cluster ceiling before batch plan lock.",
      "observed_plan_counts": {
        "source_backed_segments": 80,
        "eligible_candidates": 18,
        "candidate_capacity_at_two_uses": 36,
        "minimum_candidates_for_80_shots_at_two_uses": 40,
        "speaker_shots": {
          "li_naiwen": 40,
          "xiao_shenyang": 40,
          "lin_zicong": 0,
          "xiaohai": 0
        }
      }
    }
  ],
  "record_content_sha256": "ef93fc6ab23e82411b27aed9bf9987a5c11f459975d8661688d104e9e62a54b7"
}
