{
  "schema": "semantic-analysis-training-record/v1",
  "record_id": "global-plan-uniqueness-v5-20260904",
  "created_at": "2026-09-04T00:00:00+08:00",
  "authorization": {
    "scope": "Create V5 of the semantic-analysis training backup and append a global plan-uniqueness correction.",
    "current_user_explicit": true,
    "reference": "Current user, 2026-09-04: 出V5"
  },
  "source_batch": {
    "batch_name": "global plan uniqueness feedback",
    "sources": [
      {
        "source_path": "C:\\Users\\dd\\Documents\\Codex\\2026-09-03\\new-chat-3\\outputs\\新素材语义分析能力包_训练备份_v4.zip",
        "source_sha256": "ded5f9fdefce66cd01204ecf4c233ec131d1d5f8c5ca73f41a23c335fdf20a2f",
        "processing_stage": "V4 package lineage evidence"
      },
      {
        "source_path": "C:\\Users\\dd\\AppData\\Local\\Temp\\codex-clipboard-c1d9d69c-2ad4-43e9-8668-58ddd4256585.png",
        "source_sha256": "8880e8c191465751f136245cda94975b21dc78f3ccac99c91f8ada34fab8e499",
        "processing_stage": "user-supplied duplicate-plan failure evidence"
      }
    ]
  },
  "analysis_snapshot": {
    "snapshot_id": "global-plan-uniqueness-correction-v1",
    "scope": "Correct batch plan uniqueness semantics. No original source-media interval is reclassified.",
    "evidence_limits": [
      "This record is a user-feedback and process-evidence correction, not an independent source-media analysis.",
      "It does not authorize a production plan, rendering, or publication.",
      "It requires a future planner to retain search evidence before claiming unique-plan capacity is insufficient."
    ],
    "approved": [],
    "conditional": [],
    "rejected": [
      {
        "scope": "candidate-only batch uniqueness policy",
        "risk_codes": ["DUPLICATE_ORDERED_PLAN_SEQUENCE", "MISSING_PLAN_SIGNATURE"],
        "observed": "A per-candidate two-use ceiling can permit two plans with the identical ordered four-candidate sequence."
      }
    ]
  },
  "feedback": [
    {
      "date": "2026-09-04",
      "kind": "global plan uniqueness correction",
      "human_correction": "Different finished videos require globally unique complete ordered candidate sequences, not merely per-candidate reuse ceilings.",
      "required_gate_change": "Create immutable ordered-plan and semantic-route signatures, reject duplicate signatures before rendering, and report unique-plan capacity before plan lock."
    }
  ],
  "record_content_sha256": "7ee07f0489a5be67eef41627f5d436005bb066723a44665ba2746caed1366666"
}
