{
  "schema": "semantic-analysis-training-record/v1",
  "record_id": "executable-gate-runtime-v7-20260905",
  "created_at": "2026-09-05T11:33:43+08:00",
  "authorization": {
    "scope": "Create V7 as an executable semantic-analysis gate package with deterministic lock, render authorization, output authorization, and recovery state runtime.",
    "current_user_explicit": true,
    "reference": "Current user, 2026-09-05: 帮我改成能完全执行的V7版本"
  },
  "source_batch": {
    "batch_name": "V6 executable-contract failure evidence",
    "sources": [
      {"source_path": "C:\\Users\\dd\\Documents\\Codex\\2026-09-03\\new-chat-3\\outputs\\新素材语义分析能力包_训练备份_v6.zip", "source_sha256": "4cea669601a5f5967128e9491652d5b28a18dca4bf7fac9dda2a490138bfaf4d", "processing_stage": "validated V6 package lineage"},
      {"source_path": "C:\\Users\\dd\\Documents\\Codex\\2026-09-03\\video-fast-output-optimization\\work\\combined-v6-50-20260904\\待写入语义训练的本轮问题清单_20260904.json", "source_sha256": "9e41b28a5dd05ae838dd584c030d8a642508a6d8c60301149afd803f48a9dfb8", "processing_stage": "task-local V6 issue draft"},
      {"source_path": "C:\\Users\\dd\\Documents\\Codex\\2026-09-03\\video-fast-output-optimization\\work\\combined-v6-50-20260904\\sol实际成片失败登记_20260904.json", "source_sha256": "0c2be2d3b295e4eec7cfd47a9114b4315b315419013a3739cb37a22bd887950e", "processing_stage": "independent rendered-output failure register"},
      {"source_path": "C:\\Users\\dd\\Documents\\Codex\\2026-09-03\\video-fast-output-optimization\\work\\combined-v6-50-20260904\\task_state.json", "source_sha256": "d320e347481a5d65212255b2d1d794fd6e007962344a72d5de6e82dd708b5a0b", "processing_stage": "V6 task recovery state"},
      {"source_path": "C:\\Users\\dd\\Documents\\Codex\\2026-09-03\\video-fast-output-optimization\\work\\combined-v6-50-20260904\\work_order.json", "source_sha256": "eb399fe5625887dbbba8703060ccb5cd300ef913ca7c457f7f663b79b8872e77", "processing_stage": "actual V6 task work order"}
    ]
  },
  "analysis_snapshot": {
    "snapshot_id": "v6-executable-contract-failure-to-v7-runtime-v1",
    "scope": "Convert demonstrated V6 rule-to-runtime gaps into deterministic V7 gates; no original media interval is reclassified.",
    "evidence_limits": [
      "This record audits process artifacts and rendered-output failures, not every source-media frame.",
      "It does not repair, render, copy, publish, or approve any V6 media output.",
      "V7 runtime verifies structured evidence and bindings but does not replace independent semantic or perceptual review."
    ],
    "approved": [],
    "conditional": [],
    "rejected": [
      {"scope": "model-asserted or custom partial gate used as plan-lock authority", "risk_codes": ["MISSING_REQUIRED_TRACEABILITY", "WORK_ORDER_HASH_MISMATCH", "UNKNOWN_CANONICAL_PERSON"], "observed": "V6 task locked plans without the prescribed gate report, canonical person IDs, actual-ASR path/hash fields, first/last voiced fields, or plan signatures."},
      {"scope": "render from a plan not authorized by a passing immutable gate index", "risk_codes": ["ADJACENT_SAME_VISIBLE_PERSON", "CTA_OR_HARD_TEXT_CONFLICT", "BOUNDARY_CONTRACT_FAILED"], "observed": "Sol rejected 17 of the remaining 22 renders for overlapping identity, CTA, freeze, empty/double-jump, closing-identity and semantic-reset findings."}
    ]
  },
  "feedback": [
    {"date": "2026-09-05", "kind": "executable gate and recovery correction", "human_correction": "V7 must execute the rules rather than merely state them.", "required_gate_change": "Use deterministic nonzero exits, immutable gate and locked-index hashes, canonical person IDs, independent transition bindings, per-render authorization, complete output-QC authorization, and artifact-bound task-local state transitions."}
  ],
  "record_content_sha256": "b78a90b973f78b9a58beb82f6c8edd8cb773a3c83044f0cf565a1c00ef6a28cc"
}
